{
  "dataset": {
    "close_col": "close",
    "feature_mode": "compact",
    "path": "data/BTCUSDT_1h.csv"
  },
  "dataset_id": "BTCUSDT_1h",
  "error_count": 0,
  "errors": [],
  "guardrails": [
    "Each run uses the shared ESO target builders.",
    "Each run uses a temporal split; shuffle=False.",
    "Each run writes a schema-validated model_run_manifest.json."
  ],
  "output_dir": "reports\\btc_core_benchmark",
  "registry_path": "reports\\model_runs.csv",
  "run_count": 4,
  "runs": [
    {
      "features": [
        "vol_20",
        "log_return",
        "volume_imbalance",
        "vwap_dev"
      ],
      "manifest_path": "reports\\btc_core_benchmark\\volatility_h12_ridge\\model_run_manifest.json",
      "metric_direction": "lower",
      "model_type": "ridge",
      "name": "volatility_h12_ridge",
      "primary_metric": "mae_vs_vol_20_persistence",
      "primary_value": 0.0003200944278963986,
      "run_id": "bcb0e0fd2cd24510",
      "split": {
        "shuffle": false,
        "test_size": 31546,
        "train_size": 15000
      },
      "target": {
        "horizon": 12,
        "name": "future_rv_12",
        "type": "regression"
      },
      "task": "volatility"
    },
    {
      "features": [
        "vol_20",
        "log_return",
        "volume_imbalance",
        "vwap_dev"
      ],
      "manifest_path": "reports\\btc_core_benchmark\\regime_h12_logistic\\model_run_manifest.json",
      "metric_direction": "higher",
      "model_type": "logistic",
      "name": "regime_h12_logistic",
      "primary_metric": "accuracy_vs_baseline",
      "primary_value": -0.016325366131997643,
      "run_id": "9d6be484c03e1b96",
      "split": {
        "shuffle": false,
        "test_size": 31546,
        "train_size": 15000
      },
      "target": {
        "horizon": 12,
        "name": "future_rv_12_above_train_median",
        "threshold": 0.006388463232907824,
        "type": "classification"
      },
      "task": "regime"
    },
    {
      "features": [
        "vol_20",
        "log_return",
        "volume_imbalance",
        "vwap_dev"
      ],
      "manifest_path": "reports\\btc_core_benchmark\\direction_h3_logistic\\model_run_manifest.json",
      "metric_direction": "higher",
      "model_type": "logistic",
      "name": "direction_h3_logistic",
      "primary_metric": "accuracy_vs_baseline",
      "primary_value": 0.01378720167348102,
      "run_id": "3c339779db0fa6b6",
      "split": {
        "shuffle": false,
        "test_size": 31551,
        "train_size": 15000
      },
      "target": {
        "horizon": 3,
        "name": "future_direction_3",
        "type": "classification"
      },
      "task": "direction"
    },
    {
      "features": [
        "vol_20",
        "log_return",
        "volume_imbalance",
        "vwap_dev"
      ],
      "manifest_path": "reports\\btc_core_benchmark\\direction_h12_logistic\\model_run_manifest.json",
      "metric_direction": "higher",
      "model_type": "logistic",
      "name": "direction_h12_logistic",
      "primary_metric": "accuracy_vs_baseline",
      "primary_value": -0.01730860675225865,
      "run_id": "b1fa214ca3a5838f",
      "split": {
        "shuffle": false,
        "test_size": 31545,
        "train_size": 15000
      },
      "target": {
        "horizon": 12,
        "name": "future_direction_12",
        "type": "classification"
      },
      "task": "direction"
    }
  ],
  "schema_version": "eso.benchmark_result.v1",
  "suite_name": "btc_core"
}
