{
  "dataset": {
    "close_col": "close",
    "feature_mode": "cycle",
    "path": "data/BTCUSDT_1h.csv",
    "smooth_windows": [
      6,
      24,
      72
    ],
    "umap_train_size": 27000
  },
  "dataset_id": "BTCUSDT_1h",
  "error_count": 0,
  "errors": [],
  "guardrails": [
    "Each run uses the shared ESO target builders.",
    "Each run uses a temporal split; shuffle=False.",
    "Each run writes a schema-validated model_run_manifest.json."
  ],
  "output_dir": "reports\\btc_core_benchmark_cycle",
  "registry_path": "reports\\model_runs.csv",
  "run_count": 4,
  "runs": [
    {
      "features": [
        "ring_radius",
        "vol_20",
        "sin_theta_24h",
        "cos_theta_24h",
        "sin_theta_6h",
        "cos_theta_6h",
        "sin_theta_72h",
        "cos_theta_72h",
        "lr_z20",
        "log_return"
      ],
      "manifest_path": "reports\\btc_core_benchmark_cycle\\volatility_h12_ridge\\model_run_manifest.json",
      "metric_direction": "lower",
      "model_type": "ridge",
      "name": "volatility_h12_ridge",
      "primary_metric": "mae_vs_vol_20_persistence",
      "primary_value": -0.0002408654628966861,
      "run_id": "daff2f127e0b19da",
      "split": {
        "shuffle": false,
        "test_size": 4474,
        "train_size": 15000
      },
      "target": {
        "horizon": 12,
        "name": "future_rv_12",
        "type": "regression"
      },
      "task": "volatility"
    },
    {
      "features": [
        "ring_radius",
        "vol_20",
        "sin_theta_24h",
        "cos_theta_24h",
        "sin_theta_6h",
        "cos_theta_6h",
        "sin_theta_72h",
        "cos_theta_72h",
        "lr_z20",
        "log_return"
      ],
      "manifest_path": "reports\\btc_core_benchmark_cycle\\regime_h12_logistic\\model_run_manifest.json",
      "metric_direction": "higher",
      "model_type": "logistic",
      "name": "regime_h12_logistic",
      "primary_metric": "accuracy_vs_baseline",
      "primary_value": 0.06928922664282522,
      "run_id": "8219e619025f705e",
      "split": {
        "shuffle": false,
        "test_size": 4474,
        "train_size": 15000
      },
      "target": {
        "horizon": 12,
        "name": "future_rv_12_above_train_median",
        "threshold": 0.003821547211469522,
        "type": "classification"
      },
      "task": "regime"
    },
    {
      "features": [
        "sin_theta_6h",
        "cos_theta_6h",
        "sin_theta_24h",
        "cos_theta_24h",
        "sin_theta_72h",
        "cos_theta_72h",
        "ring_radius",
        "vol_20",
        "lr_z20",
        "log_return"
      ],
      "manifest_path": "reports\\btc_core_benchmark_cycle\\direction_h3_logistic\\model_run_manifest.json",
      "metric_direction": "higher",
      "model_type": "logistic",
      "name": "direction_h3_logistic",
      "primary_metric": "accuracy_vs_baseline",
      "primary_value": 0.002455905336012587,
      "run_id": "637ffa251db26cae",
      "split": {
        "shuffle": false,
        "test_size": 4479,
        "train_size": 15000
      },
      "target": {
        "horizon": 3,
        "name": "future_direction_3",
        "type": "classification"
      },
      "task": "direction"
    },
    {
      "features": [
        "sin_theta_6h",
        "cos_theta_6h",
        "sin_theta_24h",
        "cos_theta_24h",
        "sin_theta_72h",
        "cos_theta_72h",
        "ring_radius",
        "vol_20",
        "lr_z20",
        "log_return"
      ],
      "manifest_path": "reports\\btc_core_benchmark_cycle\\direction_h12_logistic\\model_run_manifest.json",
      "metric_direction": "higher",
      "model_type": "logistic",
      "name": "direction_h12_logistic",
      "primary_metric": "accuracy_vs_baseline",
      "primary_value": -0.021233795261510924,
      "run_id": "7d81765777913939",
      "split": {
        "shuffle": false,
        "test_size": 4474,
        "train_size": 15000
      },
      "target": {
        "horizon": 12,
        "name": "future_direction_12",
        "type": "classification"
      },
      "task": "direction"
    }
  ],
  "schema_version": "eso.benchmark_result.v1",
  "suite_name": "btc_core"
}
